<?xml version="1.0" encoding="UTF-8" ?>
<!--

    MIT License

    Copyright (c) 2023 北京凯特伟业科技有限公司

    Permission is hereby granted, free of charge, to any person obtaining a copy
    of this software and associated documentation files (the "Software"), to deal
    in the Software without restriction, including without limitation the rights
    to use, copy, modify, merge, publish, distribute, sublicense, and/or sell
    copies of the Software, and to permit persons to whom the Software is
    furnished to do so, subject to the following conditions:

    The above copyright notice and this permission notice shall be included in all
    copies or substantial portions of the Software.

    THE SOFTWARE IS PROVIDED "AS IS", WITHOUT WARRANTY OF ANY KIND, EXPRESS OR
    IMPLIED, INCLUDING BUT NOT LIMITED TO THE WARRANTIES OF MERCHANTABILITY,
    FITNESS FOR A PARTICULAR PURPOSE AND NONINFRINGEMENT. IN NO EVENT SHALL THE
    AUTHORS OR COPYRIGHT HOLDERS BE LIABLE FOR ANY CLAIM, DAMAGES OR OTHER
    LIABILITY, WHETHER IN AN ACTION OF CONTRACT, TORT OR OTHERWISE, ARISING FROM,
    OUT OF OR IN CONNECTION WITH THE SOFTWARE OR THE USE OR OTHER DEALINGS IN THE
    SOFTWARE.

-->
<!ELEMENT mapper (cache-ref | cache | resultMap* | parameterMap* | sql* | insert* | update* | delete* | select* )+>
<!ATTLIST mapper
namespace CDATA #IMPLIED
>

<!ELEMENT cache-ref EMPTY>
<!ATTLIST cache-ref
namespace CDATA #REQUIRED
>

<!ELEMENT cache (property*)>
<!ATTLIST cache
type CDATA #IMPLIED
eviction CDATA #IMPLIED
flushInterval CDATA #IMPLIED
size CDATA #IMPLIED
readOnly CDATA #IMPLIED
blocking CDATA #IMPLIED
>

<!ELEMENT parameterMap (parameter+)?>
<!ATTLIST parameterMap
id CDATA #REQUIRED
type CDATA #REQUIRED
>

<!ELEMENT parameter EMPTY>
<!ATTLIST parameter
property CDATA #REQUIRED
javaType CDATA #IMPLIED
jdbcType CDATA #IMPLIED
mode (IN | OUT | INOUT) #IMPLIED
resultMap CDATA #IMPLIED
scale CDATA #IMPLIED
typeHandler CDATA #IMPLIED
>

<!ELEMENT resultMap (constructor?,id*,result*,association*,collection*, discriminator?)>
<!ATTLIST resultMap
id CDATA #REQUIRED
type CDATA #REQUIRED
extends CDATA #IMPLIED
autoMapping (true|false) #IMPLIED
>

<!ELEMENT constructor (idArg*,arg*)>

<!ELEMENT id EMPTY>
<!ATTLIST id
property CDATA #IMPLIED
javaType CDATA #IMPLIED
column CDATA #IMPLIED
jdbcType CDATA #IMPLIED
typeHandler CDATA #IMPLIED
>

<!ELEMENT result EMPTY>
<!ATTLIST result
property CDATA #IMPLIED
javaType CDATA #IMPLIED
column CDATA #IMPLIED
jdbcType CDATA #IMPLIED
typeHandler CDATA #IMPLIED
>

<!ELEMENT idArg EMPTY>
<!ATTLIST idArg
javaType CDATA #IMPLIED
column CDATA #IMPLIED
jdbcType CDATA #IMPLIED
typeHandler CDATA #IMPLIED
select CDATA #IMPLIED
resultMap CDATA #IMPLIED
name CDATA #IMPLIED
columnPrefix CDATA #IMPLIED
>

<!ELEMENT arg EMPTY>
<!ATTLIST arg
javaType CDATA #IMPLIED
column CDATA #IMPLIED
jdbcType CDATA #IMPLIED
typeHandler CDATA #IMPLIED
select CDATA #IMPLIED
resultMap CDATA #IMPLIED
name CDATA #IMPLIED
columnPrefix CDATA #IMPLIED
>

<!ELEMENT collection (constructor?,id*,result*,association*,collection*, discriminator?)>
<!ATTLIST collection
property CDATA #REQUIRED
column CDATA #IMPLIED
javaType CDATA #IMPLIED
ofType CDATA #IMPLIED
jdbcType CDATA #IMPLIED
select CDATA #IMPLIED
resultMap CDATA #IMPLIED
typeHandler CDATA #IMPLIED
notNullColumn CDATA #IMPLIED
columnPrefix CDATA #IMPLIED
resultSet CDATA #IMPLIED
foreignColumn CDATA #IMPLIED
autoMapping (true|false) #IMPLIED
fetchType (lazy|eager) #IMPLIED
>

<!ELEMENT association (constructor?,id*,result*,association*,collection*, discriminator?)>
<!ATTLIST association
property CDATA #REQUIRED
column CDATA #IMPLIED
javaType CDATA #IMPLIED
jdbcType CDATA #IMPLIED
select CDATA #IMPLIED
resultMap CDATA #IMPLIED
typeHandler CDATA #IMPLIED
notNullColumn CDATA #IMPLIED
columnPrefix CDATA #IMPLIED
resultSet CDATA #IMPLIED
foreignColumn CDATA #IMPLIED
autoMapping (true|false) #IMPLIED
fetchType (lazy|eager) #IMPLIED
>

<!ELEMENT discriminator (case+)>
<!ATTLIST discriminator
column CDATA #IMPLIED
javaType CDATA #REQUIRED
jdbcType CDATA #IMPLIED
typeHandler CDATA #IMPLIED
>

<!ELEMENT case (constructor?,id*,result*,association*,collection*, discriminator?)>
<!ATTLIST case
value CDATA #REQUIRED
resultMap CDATA #IMPLIED
resultType CDATA #IMPLIED
>

<!ELEMENT property EMPTY>
<!ATTLIST property
name CDATA #REQUIRED
value CDATA #REQUIRED
>

<!ELEMENT typeAlias EMPTY>
<!ATTLIST typeAlias
alias CDATA #REQUIRED
type CDATA #REQUIRED
>

<!ELEMENT select (#PCDATA | include | trim | where | set | foreach | choose | if | bind | meta)*>
<!ATTLIST select
id CDATA #REQUIRED
parameterMap CDATA #IMPLIED
parameterType CDATA #IMPLIED
resultMap CDATA #IMPLIED
resultType CDATA #IMPLIED
resultSetType (FORWARD_ONLY | SCROLL_INSENSITIVE | SCROLL_SENSITIVE | DEFAULT) #IMPLIED
statementType (STATEMENT|PREPARED|CALLABLE) #IMPLIED
fetchSize CDATA #IMPLIED
timeout CDATA #IMPLIED
flushCache (true|false) #IMPLIED
useCache (true|false) #IMPLIED
databaseId CDATA #IMPLIED
lang CDATA #IMPLIED
resultOrdered (true|false) #IMPLIED
resultSets CDATA #IMPLIED
>

<!-- generator在useGeneratedKeys=true 时生效，默认default，meta:使用Meta元数据主键策略|default:mybatis默认策略Jdbc3KeyGenerator -->
<!-- table在generator=router 时生效，无此属性默认使用MetaRouterKeyGenerator，使用table对应的主键策略KeyGenerator -->
<!ELEMENT insert (#PCDATA | selectKey | include | trim | where | set | foreach | choose | if | bind | meta)*>
<!ATTLIST insert
id CDATA #REQUIRED
parameterMap CDATA #IMPLIED
parameterType CDATA #IMPLIED
timeout CDATA #IMPLIED
flushCache (true|false) #IMPLIED
statementType (STATEMENT|PREPARED|CALLABLE) #IMPLIED
keyProperty CDATA #IMPLIED
useGeneratedKeys (true|false) #IMPLIED
generator (meta|default) #IMPLIED
table CDATA #IMPLIED
keyColumn CDATA #IMPLIED
databaseId CDATA #IMPLIED
lang CDATA #IMPLIED
>

<!ELEMENT selectKey (#PCDATA | include | trim | where | set | foreach | choose | if | bind | meta)*>
<!ATTLIST selectKey
resultType CDATA #IMPLIED
statementType (STATEMENT|PREPARED|CALLABLE) #IMPLIED
keyProperty CDATA #IMPLIED
keyColumn CDATA #IMPLIED
order (BEFORE|AFTER) #IMPLIED
databaseId CDATA #IMPLIED
>

<!ELEMENT update (#PCDATA | selectKey | include | trim | where | set | foreach | choose | if | bind | meta)*>
<!ATTLIST update
id CDATA #REQUIRED
parameterMap CDATA #IMPLIED
parameterType CDATA #IMPLIED
timeout CDATA #IMPLIED
flushCache (true|false) #IMPLIED
statementType (STATEMENT|PREPARED|CALLABLE) #IMPLIED
keyProperty CDATA #IMPLIED
useGeneratedKeys (true|false) #IMPLIED
keyColumn CDATA #IMPLIED
databaseId CDATA #IMPLIED
lang CDATA #IMPLIED
>

<!ELEMENT delete (#PCDATA | include | trim | where | set | foreach | choose | if | bind | meta)*>
<!ATTLIST delete
id CDATA #REQUIRED
parameterMap CDATA #IMPLIED
parameterType CDATA #IMPLIED
timeout CDATA #IMPLIED
flushCache (true|false) #IMPLIED
statementType (STATEMENT|PREPARED|CALLABLE) #IMPLIED
databaseId CDATA #IMPLIED
lang CDATA #IMPLIED
>

<!-- Dynamic -->

<!ELEMENT include (property+)?>
<!ATTLIST include
refid CDATA #REQUIRED
>

<!ELEMENT bind EMPTY>
<!ATTLIST bind
 name CDATA #REQUIRED
 value CDATA #REQUIRED
>

<!ELEMENT sql (#PCDATA | include | trim | where | set | foreach | choose | if | bind | meta)*>
<!ATTLIST sql
id CDATA #REQUIRED
lang CDATA #IMPLIED
databaseId CDATA #IMPLIED
>

<!ELEMENT trim (#PCDATA | include | trim | where | set | foreach | choose | if | bind | meta)*>
<!ATTLIST trim
prefix CDATA #IMPLIED
prefixOverrides CDATA #IMPLIED
suffix CDATA #IMPLIED
suffixOverrides CDATA #IMPLIED
>
<!ELEMENT where (#PCDATA | include | trim | where | set | foreach | choose | if | bind | meta)*>
<!ELEMENT set (#PCDATA | include | trim | where | set | foreach | choose | if | bind | meta)*>

<!ELEMENT foreach (#PCDATA | include | trim | where | set | foreach | choose | if | bind | meta)*>
<!ATTLIST foreach
collection CDATA #REQUIRED
item CDATA #IMPLIED
index CDATA #IMPLIED
open CDATA #IMPLIED
close CDATA #IMPLIED
separator CDATA #IMPLIED
>

<!ELEMENT choose (when* , otherwise?)>
<!ELEMENT when (#PCDATA | include | trim | where | set | foreach | choose | if | bind | meta)*>
<!ATTLIST when
test CDATA #REQUIRED
>
<!ELEMENT otherwise (#PCDATA | include | trim | where | set | foreach | choose | if | bind | meta)*>

<!ELEMENT if (#PCDATA | include | trim | where | set | foreach | choose | if | bind | meta)*>
<!ATTLIST if
test CDATA #REQUIRED
>

<!-- meta标签 可根据参数获取到对应的表名 动态生成语句 -->
<!ELEMENT meta EMPTY>
<!ATTLIST meta
test CDATA #IMPLIED
type (update|insert|insertBatch|select|columns|pk-col|load|load-columns) #IMPLIED
ignore CDATA #IMPLIED
table CDATA #IMPLIED
func CDATA #IMPLIED
alias CDATA #IMPLIED
>


