<?xml version="1.0" encoding="UTF-8" ?>


<!DOCTYPE mapper
        PUBLIC "-//mybatis.org//DTD Mapper 3.0//EN"
        "http://www.mybatis.org/dtd/mybatis-3-mapper.dtd">

<mapper namespace="com.ssitao.code.modular.oauth2.server.dao.OAuth2AccessDao">
    <resultMap id="OAuth2AccessResultMap" type="com.ssitao.code.modular.oauth2.server.entity.SimpleOAuth2AccessEntity">
        <result property="clientId" column="client_id" javaType="String" jdbcType="VARCHAR"/>
        <result property="ownerId" column="owner_id" javaType="String" jdbcType="VARCHAR"/>
        <result property="accessToken" column="access_token" javaType="String" jdbcType="VARCHAR"/>
        <result property="expiresIn" column="expires_in" javaType="Integer" jdbcType="NUMERIC"/>
        <result property="refreshToken" column="refresh_token" javaType="String" jdbcType="VARCHAR"/>
        <result property="createTime" column="create_time" javaType="Long" jdbcType="NUMERIC"/>
        <result property="updateTime" column="update_time" javaType="Long" jdbcType="NUMERIC"/>
        <result property="scope" column="scope" javaType="java.util.Set" jdbcType="VARCHAR"/>
        <result property="grantType" column="grant_type" javaType="String" jdbcType="VARCHAR"/>
    </resultMap>

    <!--用于动态生成sql所需的配置-->
    <sql id="config">
        <bind name="resultMapId" value="'OAuth2AccessResultMap'"/>
        <bind name="tableName" value="'s_oauth2_access'"/>
    </sql>

    <insert id="insert" parameterType="com.tweb.commons.entity.Entity">
        <include refid="config"/>
        <include refid="BasicMapper.buildInsertSql"/>
    </insert>

    <delete id="delete" parameterType="com.tweb.commons.entity.Entity">
        <include refid="config"/>
        <include refid="BasicMapper.buildDeleteSql"/>
    </delete>

    <update id="update" parameterType="com.tweb.commons.entity.Entity">
        <include refid="config"/>
        <include refid="BasicMapper.buildUpdateSql"/>
    </update>

    <select id="query" parameterType="com.tweb.commons.entity.Entity" resultMap="OAuth2AccessResultMap">
        <include refid="config"/>
        <include refid="BasicMapper.buildSelectSql"/>
    </select>

    <select id="count" parameterType="com.tweb.commons.entity.Entity" resultType="int">
        <include refid="config"/>
        <include refid="BasicMapper.buildTotalSql"/>
    </select>
</mapper>
