<?xml version="1.0" encoding="UTF-8" ?>


<!DOCTYPE mapper
        PUBLIC "-//mybatis.org//DTD Mapper 3.0//EN"
        "http://www.mybatis.org/dtd/mybatis-3-mapper.dtd">

<mapper namespace="com.ssitao.code.modular.oauth2.server.dao.AuthorizationCodeDao">
    <resultMap id="AuthorizationCodeResultMap" type="com.ssitao.code.modular.oauth2.server.entity.AuthorizationCodeEntity">
        <result property="clientId" column="client_id" javaType="String" jdbcType="VARCHAR"/>
        <result property="userId" column="user_id" javaType="String" jdbcType="VARCHAR"/>
        <result property="code" column="code" javaType="String" jdbcType="VARCHAR"/>
        <result property="createTime" column="create_time" javaType="Long" jdbcType="NUMERIC"/>
        <result property="scope" column="scope" javaType="java.util.Set" jdbcType="VARCHAR"/>
        <result property="redirectUri" column="redirect_uri" javaType="String" jdbcType="VARCHAR"/>
    </resultMap>

    <!--用于动态生成sql所需的配置-->
    <sql id="config">
        <bind name="resultMapId" value="'AuthorizationCodeResultMap'"/>
        <bind name="tableName" value="'s_oauth2_auth_code'"/>
        <include refid="BasicMapper.switcher"/>
    </sql>

    <insert id="insert" parameterType="com.ssitao.code.modular.oauth2.server.entity.AuthorizationCodeEntity">
        <include refid="config"/>
        <include refid="BasicMapper.buildInsertSql"/>
    </insert>

    <delete id="delete" parameterType="com.tweb.commons.entity.Entity">
        <include refid="config"/>
        <include refid="BasicMapper.buildDeleteSql"/>
    </delete>

    <select id="query" parameterType="com.tweb.commons.entity.Entity" resultMap="AuthorizationCodeResultMap">
        <include refid="config"/>
        <include refid="BasicMapper.buildSelectSql"/>
    </select>

    <select id="count" parameterType="com.tweb.commons.entity.Entity" resultType="int">
        <include refid="config"/>
        <include refid="BasicMapper.buildTotalSql"/>
    </select>
</mapper>
