<?xml version="1.0" encoding="UTF-8" ?>


<!DOCTYPE mapper
        PUBLIC "-//mybatis.org//DTD Mapper 3.0//EN"
        "http://www.mybatis.org/dtd/mybatis-3-mapper.dtd">

<mapper namespace="com.ssitao.code.modular.oauth2.server.dao.OAuth2ClientDao">
    <resultMap id="OAuth2ClientResultMap" type="com.ssitao.code.modular.oauth2.server.entity.SimpleOAuth2ClientEntity">
        <id property="id" column="u_id" javaType="String" jdbcType="VARCHAR"/>
        <result property="secret" column="secret" javaType="String" jdbcType="VARCHAR"/>
        <result property="name" column="name" javaType="String" jdbcType="VARCHAR"/>
        <result property="describe" column="describe" javaType="String" jdbcType="VARCHAR"/>
        <result property="type" column="type" javaType="String" jdbcType="VARCHAR"/>
        <result property="ownerId" column="owner_id" javaType="String" jdbcType="VARCHAR"/>
        <result property="creatorId" column="creator_id" javaType="String" jdbcType="VARCHAR"/>
        <result property="redirectUri" column="redirect_uri" javaType="String" jdbcType="VARCHAR"/>
        <result property="createTime" column="create_time" javaType="Long" jdbcType="NUMERIC"/>
        <result property="supportGrantTypes" column="support_grant_types" javaType="java.util.Set" jdbcType="VARCHAR"/>
        <result property="defaultGrantScope" column="default_grant_scope" javaType="java.util.Set" jdbcType="VARCHAR"/>
        <result property="status" column="status" javaType="Byte" jdbcType="NUMERIC"/>
    </resultMap>

    <!--用于动态生成sql所需的配置-->
    <sql id="config">
        <bind name="resultMapId" value="'OAuth2ClientResultMap'"/>
        <bind name="tableName" value="'s_oauth2_client'"/>
    </sql>

    <insert id="insert" parameterType="com.tweb.commons.entity.Entity">
        <include refid="config"/>
        <include refid="BasicMapper.buildInsertSql"/>
    </insert>

    <delete id="deleteByPk" parameterType="String">
        <include refid="config"/> <include refid="BasicMapper.switcher"/>
        delete from ${_fullTableName} where u_id =#{id}
    </delete>

    <delete id="delete" parameterType="com.tweb.commons.entity.Entity">
        <include refid="config"/>
        <include refid="BasicMapper.buildDeleteSql"/>
    </delete>

    <update id="update" parameterType="com.tweb.commons.entity.Entity">
        <include refid="config"/>
        <include refid="BasicMapper.buildUpdateSql"/>
    </update>

    <select id="query" parameterType="com.tweb.commons.entity.Entity" resultMap="OAuth2ClientResultMap">
        <include refid="config"/>
        <include refid="BasicMapper.buildSelectSql"/>
    </select>

    <select id="count" parameterType="com.tweb.commons.entity.Entity" resultType="int">
        <include refid="config"/>
        <include refid="BasicMapper.buildTotalSql"/>
    </select>
</mapper>
